{
  "schema_version": "1.0",
  "probe_id": "conditional-is-medium2k-p32-mechanism-round1",
  "compiled_space_sha256": "3c0c5a800f1d22739cb1b1a92a308c969cf2f200b0b548e1279fbd943d73f9b3",
  "selection_context": {
    "algorithm_id": "conditional_is_small_proposal",
    "semantic_cohort_id": "conditional_is_small_proposal",
    "graph_sha256": "a46acdc960d12f5dab0af3515d083f1cf6780af34870e1febc01f85e86249cea",
    "accepted_evidence_semantic_classes": ["exact"],
    "workload_id": "gsm8k-medium2k-p32-closed-loop-20260905-transfer",
    "environment_id": "liteserver-159-npu2-ascend910b3-vllm018-20260905",
    "static_features": {
      "workload.arrival_qps": 0.0,
      "workload.context_tokens": 2048,
      "workload.prefix_mode": "unique",
      "workload.prompt_length_regime": "medium2k",
      "workload.requests": 32,
      "workload.workers": 32
    },
    "static_feature_ranges": {
      "workload.prompt_tokens.mean": {
        "minimum": 2000,
        "maximum": 2400
      }
    }
  },
  "control_settings": {
    "model_runner": "MRV1",
    "base_max_num_seqs": 40,
    "proposal_max_num_seqs": 48,
    "base_max_num_batched_tokens": 10240,
    "proposal_max_num_batched_tokens": 12288,
    "base_memory_fraction": 0.54,
    "proposal_memory_fraction": 0.36,
    "base_batch_wait_seconds": 0.0,
    "proposal_batch_wait_seconds": 0.02,
    "base_score_priority": 1,
    "base_graph_mode": "FULL_DECODE_ONLY",
    "base_graph_capture_sizes": [1, 2, 4, 8, 16, 24, 32, 40],
    "proposal_graph_mode": "FULL_DECODE_ONLY",
    "proposal_graph_capture_sizes": [1, 2, 4, 8, 16, 24, 32, 40, 48]
  },
  "candidate_budget": 1,
  "maximum_changed_knobs": 1,
  "minimum_formal_control_rows": 4,
  "exclude_exactly_observed": true,
  "thresholds": {
    "compute_dominance_fraction": 0.6,
    "capacity_utilization_fraction": 0.8,
    "queue_to_running_ratio": 1.0,
    "kv_pressure_fraction": 0.8,
    "minimum_mechanism_score": 0.05
  }
}
